{
  "$id": "https://posthog-impact.local/schemas/component_edges.schema.json",
  "$schema": "https://json-schema.org/draft/2020-12/schema",
  "additionalProperties": false,
  "properties": {
    "dependency_graph_version": {
      "arrow_type": "string",
      "type": [
        "string",
        "null"
      ]
    },
    "edge_count": {
      "arrow_type": "int64",
      "type": [
        "integer",
        "null"
      ]
    },
    "source_component": {
      "arrow_type": "string",
      "type": [
        "string",
        "null"
      ]
    },
    "target_component": {
      "arrow_type": "string",
      "type": [
        "string",
        "null"
      ]
    }
  },
  "title": "component_edges",
  "type": "object",
  "x-pipeline-version": "1.0.0",
  "x-schema-version": "1.0.0"
}
